product_name,sds_filename,database_match,match_confidence,signal_word,hazard_statements,precautionary_statements,response_statements,components_determining_hazard,first_aid,storage,disposal,un_number,proper_shipping_name,hazard_class,packing_group,emergency_response_guide,extraction_confidence,processing_notes,processing_timestamp
SC Precision Grout,SC-Precision-Grout-sds.pdf,SC Precision Grout,1,DANGER,H351 Suspected of causing cancer H373 May cause damage to organs (Respiratory System) through prolonged or repeated exposure H335 May cause respiratory irritation H315 Causes skin irritation H317 May cause an allergic skin reaction H318 Causes serious eye damage,"P201 Obtain special instructions before use. P202 Do not handle until all safety precautions have been read and understood. P260 Do not breath dust/fume/gas/mist/vapours/spray. P264 Wash thoroughly after handling. P271 Use only outdoors or in a well-ventilated area. P272 Contaminated work clothing should not be allowed out of the workplace P270 Do not eat, drink or smoke when using this product. P280 Wear protective gloves/eye protection/face protection.",,"WT% CAS No. EINECS No. Hazard Classification Crystalline Silica (Quartz)/ Silica Sand 50 – 70% 14808-60-7 238-878-4 Carc. 2, STOT RE2 Portland Cement 25 – 45% 65997-15-1 266-043-4 STOT SE3, Skin Irrit. 2, Eye Dam. 1, Skin Sens. 1 Calcium Sulfate < 5% 10034-76-1 215-138-9 STOT SE3, Skin Irrit. 2, Eye Dam. 1 Calcium Aluminate Cement < 5% 65997-16-2 266-045-5 STOT SE3, Skin Irrit. 2, Eye Dam. 1 Fly Ash < 15% 581131-74-81 N/A N/A Balance of other ingredients are non-hazardous or less than 1% in concentration (or 0.1% for carcinogens, reproductive toxins, or respiratory sensitizers). Note: All WHMIS required information is included in appropriate","Eye Contact: If product enters the eyes, flush with plenty of water or eye wash solution for several minutes. Remove contacts if present and easy to do. Seek medical attention if irritation persists. Skin Contact: Wash skin thoroughly with soap and water after handling. Seek medical attention if irritation develops and persists.",Statements: P403+P233 Store in a well-ventilated place. Keep container tightly closed. P405 Store locked up.,". • Approach spill areas with caution. • If liquid was introduced, create a dike or trench to contain material. • Soak up with absorbent material such as clay, sand or other suitable non-reactive material. Large Spills: • Place in leak-proof containers. Seal tightly for proper disposal. • Dispose of in accordance with U.S. Federal, State, and local hazardous waste disposal regulations and those of Canada and its Provinces, those of Australia, Japan and EU Member States (see",,Not regulated,Number and Description: Not applicable,Not applicable,,86,,2025-09-25T06:16:55.829Z
Sealer Renew,Sealer-Renew-sds.pdf,Sealer Renew,1,DANGER,Flammable liquid and vapor. Harmful in contact with skin or if inhaled. Causes serious eye irritation.,,,"WT% CAS No. Xylenes, mixed isomers 60 - 100 1330 - 20 - 7 Ethylbenzene 10 - 30 100 - 41 - 4 Cumene 0.1 - 1 98 - 82 - 8 Any concentration shown as a range is to protect confidentiality or is due to process variation. Occupational exposure limits, if available, are listed in",,", including any incompatibilities : Store in accordance with local regulations. Store in a segregated and approved area. Store in original container protected from direct sunlight in a dry, cool and well - ventilated area, away from incompatible materials (see","Statements: Dispose of contents and container in accordance with all local, regional, national and international regula tions. Version 1 Sealer ReNew Hazardous Ingredients WT% CAS No. Xylenes, mixed isomers 60 - 100 1330 - 20 - 7 Ethylbenzene 10 - 30 100 - 41 - 4 Cumene 0.1 - 1 98 - 82 - 8 Any concentration shown as a range is to protect confidentiality or is due to process variation. Occupational exposure limits, if available, are listed in",,"RQ, Xylenes, 3,",Number and Description: Class 3 – Flammable Liquid Pac king,,,57,,2025-09-25T06:16:55.876Z
Sleek 1000 SLU,Sleek-1000-SLU-sds.pdf,Sleek 1000 SLU,1,DANGER,H351 Suspected of causing cancer H373 May cause damage to organs (Respiratory System) through prolonged or repeated exposure H335 May cause respiratory irritation H315 Causes skin irritation H317 May cause an allergic skin reaction H318 Causes serious eye damage,"P201 Obtain special instructions before use. P202 Do not handle until all safety precautions have been read and understood. P260 Do not breath dust/fume/gas/mist/vapours/spray. P264 Wash thoroughly after handling. P271 Use only outdoors or in a well-ventilated area. P272 Contaminated work clothing should not be allowed out of the workplace P270 Do not eat, drink or smoke when using this product. P280 Wear protective gloves/eye protection/face protection.",,"WT% CAS No. EINECS No. Hazard Classification Crystalline Silica (Quartz)/ Silica Sand 50 – 70% 14808-60-7 238-878-4 Carc. 2, STOT RE2 Cement, alumina, chemicals 10 – 45% 960375-09-1 N/A STOT SE3, Skin Irrit 2, Eye Dam. 1, STOT RE2 Limestone 10 – 30% 1317-65-3 207-439-9 STOT SE3, STOT RE1, Carc. 1 Calcium Oxide 3 – 10% 1305-78-8 215-138-9 STOT SE3, Skin Irrit. 2, Eye Dam. 1 Aluminum Sulfate 1 – 4% 10043-01-3 233-135-0 STOT SE3, Skin Irrit. 2, Eye Dam. 1 Balance of other ingredients are non-hazardous or less than 1% in concentration (or 0.1% for carcinogens, reproductive toxins, or respiratory sensitizers). Note: All WHMIS required information is included in appropriate","Eye Contact: If product enters the eyes, flush with plenty of water or eye wash solution for several minutes. Remove contacts if present and easy to do. Seek medical attention if irritation persists. Skin Contact: Wash skin thoroughly with soap and water after handling. Seek medical attention if irritation develops and persists.",Statements: P403+P233 Store in a well-ventilated place. Keep container tightly closed. P405 Store locked up.,". • Approach spill areas with caution. • If liquid was introduced, create a dike or trench to contain material. • Soak up with absorbent material such as clay, sand or other suitable non-reactive material. Large Spills: • Place in leak-proof containers. Seal tightly for proper disposal. • Dispose of in accordance with U.S. Federal, State, and local hazardous waste disposal regulations and those of Canada and its Provinces, those of Australia, Japan and EU Member States (see",,Not regulated Section 14: - TRANSPORTATION INFORMATION Section 13: – DISPOSAL CONSIDERATIONS Section 12: – ECOLOGICAL INFORMATION Section 11: – TOXICOLOGY INFORMATION Version 1 Sleek 1000 SLU,Number and Description: Not applicable,Not applicable,,86,,2025-09-25T06:16:55.900Z
Solvent 100,Solvent-100-sds.pdf,Solvent 100,1,DANGER,H226: Flammable liquid and vapor. H3 04: May be fatal if swallowed and enters airways. H335: May cause respiratory irritation. H336: May cause drowsiness or dizziness. H351: Suspected of causing cancer.,,,"Number List Citations Cumene 98 - 82 - 8 2, 5 Regulatory Lists Searched 1 = NTP CARC 3 = IARC 1 5 = IARC 2B 2 = NTP SUS 4 = IARC 2A 6 = OSHA CARC The information given is based on data available for the material, the components of the material and similar materials. ECOTOXICITY Material -- Expected to be toxic to aquatic organisms. May cause long - term adverse effects in the aquatic environment. MOBILITY Material -- Highly volatile, will partition rapidly to air. Not expected to partition to sediment and wastewater solids. PERSISTENCE AND DEGRADABILITY Biodegradation: Material -- Expected to be readily biodegradable. Hydrolysis: Material -- Transformation due to hydrolysis not expected to be significant. Photolysis: Material -- Transformation due to photolysis not expected to be significant. Atmospheric Oxidation: Material -- Expected to degrade rapidly in air",,"areas or confined spaces unless adequa tely ventilated. Prevent small spills and leakage to avoid slip hazard. Material can accumulate static charges which may cause an electrical spark (ignition source). Use proper bonding and/or ground procedures. However, bonding and grounds may not eliminat e the hazard from static accumulation. Consult local applicable standards for guidance. Additional references include American Petroleum Institute 2003 (Protection Against Ignitions Arising out of Static, Lightning and Stray Currents) or National Fire Prot ection Agency 77 (Recommended",". Prevent entry into waterways, sewers, basements or confined areas. HANDLING Avoid breathing mists or vapors. Avoid all personal contact. Potentially toxic/irritating fumes/vapors may be evolved from heated or agitated material. Use only with adequate ventilation. Do not enter storage areas or confined spaces unless adequa tely ventilated. Prevent small spills and leakage to avoid slip hazard. Material can accumulate static charges which may cause an electrical spark (ignition source). Use proper bonding and/or ground procedures. However, bonding and grounds may not eliminat e the hazard from static accumulation. Consult local applicable standards for guidance. Additional references include American Petroleum Institute 2003 (Protection Against Ignitions Arising out of Static, Lightning and Stray Currents) or National Fire Prot ection Agency 77 (Recommended",,"PETROLEUM DISTILLATES, N.O.S.",Number and Description: Class 3 (xylenes),Packing Group: III,,71,,2025-09-25T06:16:55.941Z
Spec CJ Guard,Spec-CJ-Guard-sds.pdf,Spec CJ Guard,1,WARNING,(s) May cause an allergic skin reaction.,(s) Prevention Avoid breathing dust/fume/gas/mist/vapours/spray. Contaminated work clothing must not be allowed out of the workplace. Wear protective gloves.,,"s are expected to exceed exposure limits. Glove Recommendations: Wear appropriate chemical resistant gloves. Physical State: Liquid Color: Colorless to yellow Odor: Odorless Odor Threshold: N.D. pH: 5 – 7.5 , conc: 10% Specific Gravity (77°F): 1.02 - 1.05 20 °C Melting Point: N.D. Freezing Point: N.D. Boiling point: 100°C (>212°F) Flash Point: N.D. Evaporation Rate (BuAc=1): N.D. Flammability: N.D. Explosion Limits: (lower) N/D, (upper) N/D Vapor Pressure (mmHg): N.D. Vapor Density (Air=1): N.D. Solubility: N.D. Viscosity: N.D. Thermal Decomposition Temperature: N.D. Reactivity: No hazard expected. Chemical Stability: Stable under normal conditions of use. Possibility of Hazardous Reactions: Hazardous polymerization will not occur. Conditions to Avoid: Protect from freezing. Incompatible Materials: Oxidizing agents, acids, peroxides, perchlorates, nitrates, reactive metals.",,", Including any Incompatibilities: None needed according to classification criteria. Protect from freezing. Store at room temperature. Store in original container. Incompatible Materials: Oxidizing agents, acids, peroxides, perchlorates, nitrates, reactive metals",Dispose of contents/container in accordance with local/regional/national/international regulations. IARC: No NTP: No OSHA: No,,,,,,43,Low extraction confidence,2025-09-25T06:16:55.966Z
Spec-O-Lith,Spec-O-Lith-sds.pdf,Spec-O-Lith,1,DANGER,H302 Harmful if swallowed H314 Causes severe skin burns and eye damage,"P260 Do not breathe dust or mists. P264 Wash skin thoroughly after handling. P270 Do not eat, drink or smoke when using this product. P280 Wear protective gloves/ protective clothing/ eye protection/ face protection.",,"WT% CAS No. EINECS No. Hazard Classification Sodium Silicate N < 50% 1344-09-8 215-687-4 Acute Tox. 4, Skin Corr. 2, Eye Dam. 1 Balance of other ingredients are non-hazardous or less than 1% in concentration (or 0.1% for carcinogens, reproductive toxins, or respiratory sensitizers). Note: All WHMIS required information is included in appropriate","Eye Contact: If product enters the eyes, flush with plenty of water or eye wash solution for several minutes. Remove contacts if present and easy to do. Seek medical attention if irritation persists. Skin Contact: Wash skin thoroughly with soap and water after handling. Seek medical attention if irritation develops and persists. Inhalation: If breathing becomes difficult, remove victim to fresh air. If necessary, use artificial respiration to support vital functions. Seek medical attention. Ingestion: If product is swallowed, call physician or poison center immediately. If professional advice is not available, do not induce vomiting. Never induce vomiting or give dilutents (milk or water) to someone who is unconscious, having convulsions, or who cannot swallow. Seek medical advice. Take a copy of the label and/or SDS with the victim to the health professional. Medical Conditions Generally Aggravated By Exposure: Pre-existing skin, respiratory system or eye problems may be aggravated by prolonged contact. 4.2 Symptoms and Effects Both Acute and Delayed: Exposure to skin and eyes may cause burns. 4.3 Recommendations to Physicians: Treat symptoms and eliminate overexposure. 5.1",Statements: P405 Store locked up.,". • Approach spill areas with caution. • If liquid was introduced, create a dike or trench to contain material. • Soak up with absorbent material such as clay, sand or other suitable non-reactive material. Large Spills: • Place in leak-proof containers. Seal tightly for proper disposal. • Dispose of in accordance with U.S. Federal, State, and local hazardous waste disposal regulations and those of Canada and its Provinces, those of Australia, Japan and EU Member States (see",,Not regulated,Number and Description: Not applicable,Not applicable,,86,,2025-09-25T06:16:55.989Z
SpecBlast,SpecBlast-sds.pdf,SpecBlast,1,DANGER,H302 Harmful if swallowed H314 Causes severe skin burns H318 Causes serious eye damage,"P260 Do not breathe dust or mist. P264 Wash skin thoroughly after handling. P270 Do not eat, drink or smoke when using this product. P280 Wear protective gloves/ protective clothing/ eye protection/ face protection.",,"WT% CAS No. EINECS No. Hazard Classification Glycolic Acid < 40% 79-14-1 201-180-5 Acute Tox. 4, Skin Corr. 1B, Serious Eye Dam. 1 Balance of other ingredients are non-hazardous or less than 1% in concentration (or 0.1% for carcinogens, reproductive toxins, or respiratory sensitizers). Note: All WHMIS required information is included in appropriate","Eye Contact: If product enters the eyes, flush with plenty of water or eye wash solution for several minutes. Remove contacts if present and easy to do. Seek medical attention if irritation persists. Skin Contact: Wash skin thoroughly with soap and water after handling. Seek medical attention if irritation develops and persists. Inhalation: If breathing becomes difficult, remove victim to fresh air. If necessary, use artificial respiration to support vital functions. Seek medical attention. Ingestion: If product is swallowed, call physician or poison center if you feel unwell. If professional advice is not available, do not induce vomiting. Never induce vomiting or give dilutents (milk or water) to someone who is unconscious, having convulsions, or who cannot swallow. Seek medical advice. Take a copy of the label and/or SDS with the victim to the health professional. Medical Conditions Generally Aggravated By Exposure: Pre-existing skin, respiratory system or eye problems may be aggravated by prolonged contact. 4.2 Symptoms and Effects Both Acute and Delayed: Exposure to skin and eyes may cause burns. 4.3 Recommendations to Physicians: Treat symptoms and eliminate overexposure. 5.1",Statements: P405 Store locked up.,". • Approach spill areas with caution. • If liquid was introduced, create a dike or trench to contain material. • Soak up with absorbent material such as clay, sand or other suitable non-reactive material. Large Spills: • Place in leak-proof containers. Seal tightly for proper disposal. • Dispose of in accordance with U.S. Federal, State, and local hazardous waste disposal regulations and those of Canada and its Provinces, those of Australia, Japan and EU Member States (see",,Hazard,Number and Description:,,,71,,2025-09-25T06:16:56.017Z
SpecFilm NuWay,SpecChem-CreteAway-sds.pdf,SpecFilm NuWay,0.5,DANGER,H302 Harmful if swallowed H314 Causes severe skin burns H318 Causes serious eye damage,"P260 Do not breathe dust or mist. P264 Wash skin thoroughly after handling. P270 Do not eat, drink or smoke when using this product. P280 Wear protective gloves/ protective clothing/ eye protection/ face protection.",,"WT% CAS No. EINECS No. Hazard Classification Glycolic Acid < 40% 79-14-1 201-180-5 Acute Tox. 4, Skin Corr. 1B, Serious Eye Dam. 1 Balance of other ingredients are non-hazardous or less than 1% in concentration (or 0.1% for carcinogens, reproductive toxins, or respiratory sensitizers). Note: All WHMIS required information is included in appropriate","Eye Contact: If product enters the eyes, flush with plenty of water or eye wash solution for several minutes. Remove contacts if present and easy to do. Seek medical attention if irritation persists. Skin Contact: Wash skin thoroughly with soap and water after handling. Seek medical attention if irritation develops and persists. Inhalation: If breathing becomes difficult, remove victim to fresh air. If necessary, use artificial respiration to support vital functions. Seek medical attention. Ingestion: If product is swallowed, call physician or poison center if you feel unwell. If professional advice is not available, do not induce vomiting. Never induce vomiting or give dilutents (milk or water) to someone who is unconscious, having convulsions, or who cannot swallow. Seek medical advice. Take a copy of the label and/or SDS with the victim to the health professional. Medical Conditions Generally Aggravated By Exposure: Pre-existing skin, respiratory system or eye problems may be aggravated by prolonged contact. 4.2 Symptoms and Effects Both Acute and Delayed: Exposure to skin and eyes may cause burns. 4.3 Recommendations to Physicians: Treat symptoms and eliminate overexposure. 5.1",Statements: P405 Store locked up.,". • Approach spill areas with caution. • If liquid was introduced, create a dike or trench to contain material. • Soak up with absorbent material such as clay, sand or other suitable non-reactive material. Large Spills: • Place in leak-proof containers. Seal tightly for proper disposal. • Dispose of in accordance with U.S. Federal, State, and local hazardous waste disposal regulations and those of Canada and its Provinces, those of Australia, Japan and EU Member States (see",,Acetic Acid Solution,Number and Description: Class 8 - Corrosive,Packing Group: III,,86,Low product match confidence,2025-09-25T06:16:56.039Z
SpecCity White STX,SpecCity-White-STX-sds.pdf,SpecCity White STX,1,DANGER,H315 Causes skin irritation H350 May cause cancer,P280 Wear protective gloves. P264 Wash thoroughly after handling P201 Obtain special instructions before use. P202 Do not handle until all safety precautions have been read and understood.,P302+P352 IF ON SKIN: Wash with plenty of water. P321 Specific treatment (see supplemental,"WT% CAS No. EINECS No. Hazard Classification Oleic Acid 0-2% 112-80-1 204-007-1 Skin Irrit. 2 Slack Wax 20-25% 64742-61-6 265-165-5 Carc 1B Titanium Dioxide 2-5% 13463-67-7 236-675-5 Carc 2 Balance of other ingredients are non-hazardous or less than 1% in concentration (or 0.1% for carcinogens, reproductive toxins, or respiratory sensitizers).","Eye Contact: If product enters the eyes, flush with plenty of water or eye wash solution for several minutes. Remove contacts if present and easy to do. Seek medical attention if irritation persists. Skin Contact: Wash skin thoroughly with soap and water after handling. Seek medical attention if irritation develops and persists. Inhalation: If breathing becomes difficult, remove victim to fresh air. If necessary, use artificial respiration to support vital functions. Seek medical attention. Ingestion: If product is swallowed, call physician or poison center immediately. If professional advice is not available, do not induce vomiting. Never induce vomiting or give dilutents (milk or water) to someone who is unconscious, having convulsions, or who cannot swallow. Seek medical advice. Take a copy of the label and/or SDS with the victim to the health professional. Medical Conditions Generally Aggravated By Exposure: Pre-existing skin, respiratory system or eye problems may be aggravated by prolonged contact. 4.2 Symptoms and Effects Both Acute and Delayed: Exposure to skin may cause irritation. 4.3 Recommendations to Physicians: Treat symptoms and eliminate overexposure. 5.1",Statements: P405 Store locked up.,". • Approach spill areas with caution. • If liquid was introduced, create a dike or trench to contain material. • Soak up with absorbent material such as clay, sand or other suitable non-reactive material. Large Spills: • Place in leak-proof containers. Seal tightly for proper disposal.",,Not regulated,Number and Description: Not applicable,Not applicable,,86,,2025-09-25T06:16:56.062Z
SpecCity White Concentrate,SpecCity-White-sds.pdf,SpecCity White Concentrate,1,DANGER,H315 Causes skin irritation H350 May cause cancer,P280 Wear protective gloves. P264 Wash thoroughly after handling P201 Obtain special instructions before use. P202 Do not handle until all safety precautions have been read and understood.,P302+P352 IF ON SKIN: Wash with plenty of water. P321 Specific treatment (see supplemental,"WT% CAS No. EINECS No. Hazard Classification Oleic Acid 0-2% 112-80-1 204-007-1 Skin Irrit. 2 Slack Wax 20-25% 64742-61-6 265-165-5 Carc 1B Titanium Dioxide 2-5% 13463-67-7 236-675-5 Carc 2 Balance of other ingredients are non-hazardous or less than 1% in concentration (or 0.1% for carcinogens, reproductive toxins, or respiratory sensitizers).","Eye Contact: If product enters the eyes, flush with plenty of water or eye wash solution for several minutes. Remove contacts if present and easy to do. Seek medical attention if irritation persists. Skin Contact: Wash skin thoroughly with soap and water after handling. Seek medical attention if irritation develops and persists. Inhalation: If breathing becomes difficult, remove victim to fresh air. If necessary, use artificial respiration to support vital functions. Seek medical attention. Ingestion: If product is swallowed, call physician or poison center immediately. If professional advice is not available, do not induce vomiting. Never induce vomiting or give dilutents (milk or water) to someone who is unconscious, having convulsions, or who cannot swallow. Seek medical advice. Take a copy of the label and/or SDS with the victim to the health professional. Medical Conditions Generally Aggravated By Exposure: Pre-existing skin, respiratory system or eye problems may be aggravated by prolonged contact. 4.2 Symptoms and Effects Both Acute and Delayed: Exposure to skin may cause irritation. 4.3 Recommendations to Physicians: Treat symptoms and eliminate overexposure. 5.1",Statements: P405 Store locked up.,". • Approach spill areas with caution. • If liquid was introduced, create a dike or trench to contain material. • Soak up with absorbent material such as clay, sand or other suitable non-reactive material. Large Spills: • Place in leak-proof containers. Seal tightly for proper disposal.",,Not regulated,Number and Description: Not applicable,Not applicable,,86,,2025-09-25T06:16:56.085Z
