product_name,sds_filename,database_match,match_confidence,signal_word,hazard_statements,precautionary_statements,response_statements,components_determining_hazard,first_aid,storage,disposal,un_number,proper_shipping_name,hazard_class,packing_group,emergency_response_guide,extraction_confidence,processing_notes,processing_timestamp
Muriatic Acid,Muriatic-Acid-sds.pdf,Muriatic Acid,1,DANGER,May be harmful if swallowed. Harmful if inhaled. Causes severe skin burns and eye damage. Causes serious eye damage. Maybe cause respiratory irritation.,Do not breathe mist/vapors/spray. Wash thoroughly after handling. Use only outdoors or in a well ventilated area. Wear protective gloves/eye protection/face protection.,IF SWALLOWED: Rinse mouth. Do NOT induce vomiting. IF ON SKIN: Wash with plenty of soap and water. IF ON SKIN (or hair): Remove/take off immediately all contaminated clothing. Rinse skin with water/shower. Wash contaminated,"of fumes in the air. Fire will produce irritating, corrosive and/or toxic gases. Runoff from fire control or dilution water may be corrosive and/or toxic and cause pollution. Do not allow contaminated extinguishing water to enter the soil, groundwater or surface waters. ERG Guide No. 157 Personal Precautions, Protective Equipment and Emergency Procedures: Evacuate all unprotected personnel and keep people away from and upwind of spill/leak. Put on protective equipment (see",,", Including any Incompatibilities: Storage facilities must be properly designed and diked to contain any spillage. Store tightly closed in a dry, cool and well-ventilated place. Protect containers from heat, physical damage, ignition sources and incompatible materials. Exposure Control Parameters CAS No. Material Source Value 7647-01-0 Hydrochloric Acid OSHA Ceiling: 5 ppm (7mg/m3) ACGIH Ceiling: 2 ppm NIOSH Ceiling: 5 ppm (7mg/m3) Individual protection measures, such as personal protective equipment RESPIRATORY Use NIOSH/MSHA approved respirator, following manufacturer’s recommendations when concentrations exceed permissible exposure limits. EYES Wear safety glasses with side shields to protect the eyes. An eye wash station is suggested as a good workplace practice. SKIN : Chemical resistant clothing such as coveralls/apron boots should be worn. Chemical impervious gloves. Emergency eyewash station should be in close proximity. ENGINEERING CONTROLS:","company. Container Management: Empty containers should be taken to an approved waste handling site for recycling or disposal. Since emptied containers may retain product residue, follow label warnings even after container is emptied. 14.1 U.S. Department of",,Hydrochloric acid.,Number and Description: Class 8,Packing Group: II,,86,,2025-09-25T06:16:54.138Z
Orange Peel<sup>®</sup>,Orange-Peel-sds.pdf,Orange Peel<sup>®</sup>,0.4782608695652174,DANGER,H226 Flammable liquid and vapour. H302 Harmful if swallowed H312 Harmful in contact with skin H332 Harmful if inhaled H304 May be fatal if swallowed and enters airways. H315 Causes skin irritation. H317 May cause an allergic skin reaction H319 Causes serious eye irritation H410 Very toxic to aquatic life with long lasting effects.,,,"WT% CAS No. EINECS No. Hazard Classification Glycol Ether EB < 80% 111-76-2 203-905-0 Acute Tox. Oral 4, Acute Tox. Dermal 4, Acute Tox. Inhalation 4, Skin Irrit 2, Eye Irrit. 2 D-Limonene < 40% 5989-27-5 227-813-5 Flam. Liquid 3, Skin Sens 1B, Asp Tox 1, Aquatic Chron 1 Balance of other ingredients are non-hazardous or less than 1% in concentration (or 0.1% for carcinogens, reproductive toxins, or respiratory sensitizers).","Eye Contact: If product enters the eyes, flush with plenty of water or eye wash solution for several minutes. Remove contacts if present and easy to do. Seek medical attention if irritation persists. Skin Contact: Wash skin thoroughly with soap and water after handling. Seek medical attention if irritation develops and persists. Inhalation: If breathing becomes difficult, remove victim to fresh air. If necessary, use artificial respiration to support vital functions. Seek medical attention. Ingestion: If product is swallowed, call physician or poison center immediately. If professional advice is not available, do not induce vomiting. Never induce vomiting or give dilutents (milk or water) to someone who is unconscious, having convulsions, or who cannot swallow. Seek medical advice. Take a copy of the label and/or SDS with the victim to the health professional. Medical Conditions Generally Aggravated By Exposure: Pre-existing skin, respiratory system or eye problems may be aggravated by prolonged contact. 4.2 Symptoms and Effects Both Acute and Delayed: Exposure to skin, eyes, and respiratory system may cause irritation. May cause headaches, drowsiness, or dizziness. Aspiration hazard. 4.3 Recommendations to Physicians: Treat symptoms and eliminate overexposure. 5.1",Statements: P403+P235 Store in a well-ventilated place. Keep cool. P405 Store locked up,". • Dispose of in accordance with U.S. Federal, State, and local hazardous waste disposal regulations and those of Canada and its Provinces, those of Australia, Japan and EU Member States (see",,"Flammable liquids, n.o.s. (contains D-Limonene)",Number and Description: Class 3 – Flammable liquids,Packing Group: III,,71,Low product match confidence,2025-09-25T06:16:54.169Z
OverCrete Fine,Overcrete-sds.pdf,OverCrete Fine,0.6428571428571428,DANGER,H351 Suspected of causing cancer H373 May cause damage to organs (Respiratory System) through prolonged or repeated exposure H335 May cause respiratory irritation H315 Causes skin irritation H317 May cause an allergic skin reaction H318 Causes serious eye damage,"P201 Obtain special instructions before use. P202 Do not handle until all safety precautions have been read and understood. P260 Do not breath dust/fume/gas/mist/vapours/spray. P264 Wash thoroughly after handling. P271 Use only outdoors or in a well-ventilated area. P272 Contaminated work clothing should not be allowed out of the workplace P270 Do not eat, drink or smoke when using this product. P280 Wear protective gloves/eye protection/face protection.",,"WT% CAS No. EINECS No. Hazard Classification Crystalline Silica (Quartz)/ Silica Sand 50 – 70% 14808-60-7 238-878-4 Carc. 2, STOT RE2 Portland Cement 25 – 45% 65997-15-1 266-043-4 STOT SE3, Skin Irrit. 2, Eye Dam. 1, Skin Sens. 1 Calcium Oxide 3 – 10% 1305-78-8 215-138-9 STOT SE3, Skin Irrit. 2, Eye Dam. 1 Aluminum Sulfate 1 – 4% 10043-01-3 233-135-0 STOT SE3, Skin Irrit. 2, Eye Dam. 1 Balance of other ingredients are non-hazardous or less than 1% in concentration (or 0.1% for carcinogens, reproductive toxins, or respiratory sensitizers). Note: All WHMIS required information is included in appropriate","Eye Contact: If product enters the eyes, flush with plenty of water or eye wash solution for several minutes. Remove contacts if present and easy to do. Seek medical attention if irritation persists. Skin Contact: Wash skin thoroughly with soap and water after handling. Seek medical attention if irritation develops and persists.",Statements: P403+P233 Store in a well-ventilated place. Keep container tightly closed. P405 Store locked up.,". • Approach spill areas with caution. • If liquid was introduced, create a dike or trench to contain material. • Soak up with absorbent material such as clay, sand or other suitable non-reactive material. Large Spills: • Place in leak-proof containers. Seal tightly for proper disposal. • Dispose of in accordance with U.S. Federal, State, and local hazardous waste disposal regulations and those of Canada and its Provinces, those of Australia, Japan and EU Member States (see",,Not regulated,Number and Description: Not applicable,Not applicable,,86,Low product match confidence,2025-09-25T06:16:54.194Z
Pave Cure AMS Caltrans,Pave-Cure-AMS-Caltrans-sds.pdf,Pave Cure AMS Caltrans,1,DANGER,H315 Causes skin irritation H340 May cause genetic defects H350 May cause cancer H304 May be fatal if swallowed and enters airways H372 Causes damage to organs through prolonged or repeated exposure (Central Nervous System),"P 280 Wear protective gloves/eye protection/face protection. P264 Wash thoroughly after handling. P201 Obtain special instructions before use. P202 Do not handle until all safety precautions have been read and understood. P260 Do not breathe dust/fume/gas/mist/vapours/spray. P270 Do not eat, drink or smoke when using this product.",P302+P352 IF ON SKIN: Wash with plenty of water. P321 Specific treatment (see supplemental,"WT% CAS No. EINECS No. Hazard Classification Mineral Spirits 5% 8052-41-3 232-489-3 Carc 1B, Muta. 1B, STOT RE 1 (nervous) ASP. Tox. 1 Fatty Acid(Oleic Acid) 0-2% 112-80-1 204-007-1 Skin Irrit 2 Titanium Dioxide 2-5% 13463-67-7 236-675-5 Carc 2 Balance of other ingredients are non-hazardous or less than 1% in concentration (or 0.1% for carcinogens, reproductive toxins, or respiratory sensitizers). Note: All WHMIS required information is included in appropriate","Eye Contact: If product enters the eyes, flush with plenty of water or eye wash solution for several minutes. Remove contacts if present and easy to do. Seek medical attention if irritation persists. Skin Contact: Wash skin thoroughly with soap and water after handling. Seek medical attention if irritation develops and persists. Inhalation: If breathing becomes difficult, remove victim to fresh air. If necessary, use artificial respiration to support vital functions. Seek medical attention. Ingestion: If product is swallowed, call physician or poison center immediately. If professional advice is not available, do not induce vomiting. Never induce vomiting or give dilutents (milk or water) to someone who is unconscious, having convulsions, or who cannot swallow. Seek medical advice. Take a copy of the label and/or SDS with the victim to the health professional. Medical Conditions Generally Aggravated By Exposure: Pre-existing skin, respiratory system or eye problems may be aggravated by prolonged contact.","and use. 10.3 Possibility of Hazardous Reactions: Will not occur. 10.4 Conditions to Avoid: Avoid excessive temperatures, exposure to sunlight, sources of ignition.",". • Approach spill areas with caution. • If liquid was introduced, create a dike or trench to contain material. • Soak up with absorbent material such as clay, sand or other suitable non-reactive material. Large Spills: • Place in leak-proof containers. Seal tightly for proper disposal. • Dispose of in accordance with U.S. Federal, State, and local hazardous waste disposal regulations and those of Canada and its Provinces, those of Australia, Japan and EU Member States (see",,Not regulated,Number and Description: Not applicable,Not applicable,,86,,2025-09-25T06:16:54.229Z
Pave Cure AMS,Pave-Cure-AMS-sds.pdf,Pave Cure AMS,1,DANGER,H315 Causes skin irritation H340 May cause genetic defects H350 May cause cancer H304 May be fatal if swallowed and enters airways H372 Causes damage to organs through prolonged or repeated exposure (Central Nervous System),"P 280 Wear protective gloves/eye protection/face protection. P264 Wash thoroughly after handling. P201 Obtain special instructions before use. P202 Do not handle until all safety precautions have been read and understood. P260 Do not breathe dust/fume/gas/mist/vapours/spray. P270 Do not eat, drink or smoke when using this product.",P302+P352 IF ON SKIN: Wash with plenty of water. P321 Specific treatment (see supplemental,"WT% CAS No. EINECS No. Hazard Classification Mineral Spirits 5% 8052-41-3 232-489-3 Carc 1B, Muta. 1B, STOT RE 1 (nervous) ASP. Tox. 1 Fatty Acid(Oleic Acid) 0-2% 112-80-1 204-007-1 Skin Irrit 2 Titanium Dioxide 2-5% 13463-67-7 236-675-5 Carc 2 Balance of other ingredients are non-hazardous or less than 1% in concentration (or 0.1% for carcinogens, reproductive toxins, or respiratory sensitizers). Note: All WHMIS required information is included in appropriate","Eye Contact: If product enters the eyes, flush with plenty of water or eye wash solution for several minutes. Remove contacts if present and easy to do. Seek medical attention if irritation persists. Skin Contact: Wash skin thoroughly with soap and water after handling. Seek medical attention if irritation develops and persists. Inhalation: If breathing becomes difficult, remove victim to fresh air. If necessary, use artificial respiration to support vital functions. Seek medical attention. Ingestion: If product is swallowed, call physician or poison center immediately. If professional advice is not available, do not induce vomiting. Never induce vomiting or give dilutents (milk or water) to someone who is unconscious, having convulsions, or who cannot swallow. Seek medical advice. Take a copy of the label and/or SDS with the victim to the health professional. Medical Conditions Generally Aggravated","and use. 10.3 Possibility of Hazardous Reactions: Will not occur. 10.4 Conditions to Avoid: Avoid excessive temperatures, exposure to sunlight, sources of ignition.",". • Approach spill areas with caution. • If liquid was introduced, create a dike or trench to contain material. • Soak up with absorbent material such as clay, sand or other suitable non-reactive material. Large Spills: • Place in leak-proof containers. Seal tightly for proper disposal. • Dispose of in accordance with U.S. Federal, State, and local hazardous waste disposal regulations and those of Canada and its Provinces, those of Australia, Japan and EU Member States (see",,Not regulated,Number and Description: Not applicable,Not applicable,,86,,2025-09-25T06:16:54.253Z
Pave Cure CW Caltrans,Pave-Cure-CW-Caltrans-sds.pdf,Pave Cure CW Caltrans,1,DANGER,H315 Causes skin irritation H350 May cause cancer,P280 Wear protective gloves. P264 Wash thoroughly after handling P201 Obtain special instructions before use. P202 Do not handle until all safety precautions have been read and understood.,P302+P352 IF ON SKIN: Wash with plenty of water. P321 Specific treatment (see supplemental,"WT% CAS No. EINECS No. Hazard Classification Oleic Acid 0-2% 112-80-1 204-007-1 Skin Irrit. 2 Slack Wax 20-25% 64742-61-6 265-165-5 Carc 1B Balance of other ingredients are non-hazardous or less than 1% in concentration (or 0.1% for carcinogens, reproductive toxins, or respiratory sensitizers). Note: All WHMIS required information is included in appropriate","Eye Contact: If product enters the eyes, flush with plenty of water or eye wash solution for several minutes. Remove contacts if present and easy to do. Seek medical attention if irritation persists. Skin Contact: Wash skin thoroughly with soap and water after handling. Seek medical attention if irritation develops and persists. Inhalation: If breathing becomes difficult, remove victim to fresh air. If necessary, use artificial respiration to support vital functions. Seek medical attention. Ingestion: If product is swallowed, call physician or poison center immediately. If professional advice is not available, do not induce vomiting. Never induce vomiting or give dilutents (milk or water) to someone who is unconscious, having convulsions, or who cannot swallow. Seek medical advice. Take a copy of the label and/or SDS with the victim to the health professional. Medical Conditions Generally Aggravated By Exposure: Pre-existing skin, respiratory system or eye problems may be aggravated by prolonged contact. 4.2 Symptoms and Effects Both Acute and Delayed: Exposure to skin may cause irritation. 4.3 Recommendations to Physicians: Treat symptoms and eliminate overexposure. 5.1",Statements: P405 Store locked up.,". • Approach spill areas with caution. • If liquid was introduced, create a dike or trench to contain material. • Soak up with absorbent material such as clay, sand or other suitable non-reactive material. Large Spills: • Place in leak-proof containers. Seal tightly for proper disposal. • Dispose of in accordance with U.S. Federal, State, and local hazardous waste disposal regulations and those of Canada and its Provinces, those of Australia, Japan and EU Member States (see",,Not regulated,Number and Description: Not applicable,Not applicable,,86,,2025-09-25T06:16:54.275Z
Pave Cure CW with Dye TX Type I,Pave-Cure-CW-W-Dye-TX-Type-I-sds.pdf,Pave Cure CW with Dye TX Type I,0.9032258064516129,DANGER,H315 Causes skin irritation H350 May cause cancer,P280 Wear protective gloves. P264 Wash thoroughly after handling P201 Obtain special instructions before use. P202 Do not handle until all safety precautions have been read and understood.,P302+P352 IF ON SKIN: Wash with plenty of water. P321 Specific treatment (see supplemental,"WT% CAS No. EINECS No. Hazard Classification Oleic Acid 0-2% 112-80-1 204-007-1 Skin Irrit. 2 Slack Wax 20-25% 64742-61-6 265-165-5 Carc 1B Balance of other ingredients are non-hazardous or less than 1% in concentration (or 0.1% for carcinogens, reproductive toxins, or respiratory sensitizers). Note: All WHMIS required information is included in appropriate","Eye Contact: If product enters the eyes, flush with plenty of water or eye wash solution for several minutes. Remove contacts if present and easy to do. Seek medical attention if irritation persists. Skin Contact: Wash skin thoroughly with soap and water after handling. Seek medical attention if irritation develops and persists. Inhalation: If breathing becomes difficult, remove victim to fresh air. If necessary, use artificial respiration to support vital functions. Seek medical attention. Ingestion: If product is swallowed, call physician or poison center immediately. If professional advice is not available, do not induce vomiting. Never induce vomiting or give dilutents (milk or water) to someone who is unconscious, having convulsions, or who cannot swallow. Seek medical advice. Take a copy of the label and/or SDS with the victim to the health professional. Medical Conditions Generally Aggravated By Exposure: Pre-existing skin, respiratory system or eye problems may be aggravated by prolonged contact. 4.2 Symptoms and Effects Both Acute and Delayed: Exposure to skin may cause irritation. 4.3 Recommendations to Physicians: Treat symptoms and eliminate overexposure. 5.1",Statements: P405 Store locked up.,". • Approach spill areas with caution. • If liquid was introduced, create a dike or trench to contain material. • Soak up with absorbent material such as clay, sand or other suitable non-reactive material. Large Spills: • Place in leak-proof containers. Seal tightly for proper disposal. • Dispose of in accordance with U.S. Federal, State, and local hazardous waste disposal regulations and those of Canada and its Provinces, those of Australia, Japan and EU Member States (see",,Not regulated,Number and Description: Not applicable,Not applicable,,86,,2025-09-25T06:16:54.299Z
Pave Cure WW,Pave-Cure-CW-sds.pdf,Pave Cure WW,0.9166666666666666,DANGER,H315 Causes skin irritation H350 May cause cancer,P280 Wear protective gloves. P264 Wash thoroughly after handling P201 Obtain special instructions before use. P202 Do not handle until all safety precautions have been read and understood.,P302+P352 IF ON SKIN: Wash with plenty of water. P321 Specific treatment (see supplemental,"WT% CAS No. EINECS No. Hazard Classification Oleic Acid 0-2% 112-80-1 204-007-1 Skin Irrit. 2 Slack Wax 20-25% 64742-61-6 265-165-5 Carc 1B Balance of other ingredients are non-hazardous or less than 1% in concentration (or 0.1% for carcinogens, reproductive toxins, or respiratory sensitizers). Note: All WHMIS required information is included in appropriate","Eye Contact: If product enters the eyes, flush with plenty of water or eye wash solution for several minutes. Remove contacts if present and easy to do. Seek medical attention if irritation persists. Skin Contact: Wash skin thoroughly with soap and water after handling. Seek medical attention if irritation develops and persists. Inhalation: If breathing becomes difficult, remove victim to fresh air. If necessary, use artificial respiration to support vital functions. Seek medical attention. Ingestion: If product is swallowed, call physician or poison center immediately. If professional advice is not available, do not induce vomiting. Never induce vomiting or give dilutents (milk or water) to someone who is unconscious, having convulsions, or who cannot swallow. Seek medical advice. Take a copy of the label and/or SDS with the victim to the health professional. Medical Conditions Generally Aggravated By Exposure: Pre-existing skin, respiratory system or eye problems may be aggravated by prolonged contact. 4.2 Symptoms and Effects Both Acute and Delayed: Exposure to skin may cause irritation. 4.3 Recommendations to Physicians: Treat symptoms and eliminate overexposure. 5.1",Statements: P405 Store locked up.,". • Approach spill areas with caution. • If liquid was introduced, create a dike or trench to contain material. • Soak up with absorbent material such as clay, sand or other suitable non-reactive material. Large Spills: • Place in leak-proof containers. Seal tightly for proper disposal. • Dispose of in accordance with U.S. Federal, State, and local hazardous waste disposal regulations and those of Canada and its Provinces, those of Australia, Japan and EU Member States (see",,Not regulated,Number and Description: Not applicable,Not applicable,,86,,2025-09-25T06:16:54.323Z
Pave Cure CW Caltrans,Pave-Cure-Rez-Caltrans-sds.pdf,Pave Cure CW Caltrans,0.8636363636363636,DANGER,H315 Causes skin irritation H340 May cause genetic defects H350 May cause cancer H304 May be fatal if swallowed and enters airways H372 Causes damage to organs through prolonged or repeated exposure (Central Nervous System),"P 280 Wear protective gloves/eye protection/face protection. P264 Wash thoroughly after handling. P201 Obtain special instructions before use. P202 Do not handle until all safety precautions have been read and understood. P260 Do not breathe dust/fume/gas/mist/vapours/spray. P270 Do not eat, drink or smoke when using this product.",P302+P352 IF ON SKIN: Wash with plenty of water. P321 Specific treatment (see supplemental,"WT% CAS No. EINECS No. Hazard Classification Mineral Spirits 5 % 8052 - 41 - 3 232 - 489 - 3 Carc 1 B, Muta. 1B, STOT RE 1 (nervous ) ASP. Tox. 1 Fatty Acid(Oleic Acid) 0 - 2% 112 - 80 - 1 204 - 007 - 1 Skin Irrit 2 Balance of other ingredients are non - hazardous or less than 1% in concentration (or 0.1% for carcinogens, reproductive toxins, or respiratory sensitizers). Note: All WHMIS required information is included in appropriate","Eye Contact: If product enters the eyes, flush with plenty of water or eye wash solution for several minutes. Remove contacts if present and easy to do. Seek medical attention if irritation persists. Skin Contact: Wash skin thoroughly with soap and wate r after handling. Seek medical attention if irritation develops and persists. Inhalation: If breathing becomes difficult, remove victim to fresh air. If necessary, use artificial respiration to support vital functio ns. Seek medical attention. Ingestion: If product is swallowed, call physician or poison center immediately. If professional advice is not available, do not induce vomiting. Never induce vomiting or give dilutents (milk or water) to someone who is unconscious, having convulsions, o r who cannot swallow. Seek medical advice. Take a copy of the label and/or SDS with the victim to the health professional. Medical Conditions Generally Aggravated By Exposure: Pre - existing skin, respiratory system or eye problems may be aggravated by prolonged contact.","and use. 10.3 Possibility of Hazardous Reactions : Will not occur. 10.4 Conditions to Avoid: Avoid excessive temperatures, exposure to sunlight, sources of ignition.",". • Approach spill areas with caution. • If liquid was introduced, create a dike or trench to contain material. • Soak up with absorbent material such as clay, sand or other suitable non - reactive material. Large Spills: • Place in leak - proof containers. Seal tightly for proper disposal. • Dispose of in accordance with U.S. Federal, State, and local hazardous waste disposal regulations and those of Canada and its Provinces, those of Australia, Japan and EU Member States (see",,Not regulated,Number and Description: Not applicable,Not applicable,,86,,2025-09-25T06:16:54.354Z
